{
    "type": "onap.policies.controlloop.operational.common.Drools",
    "type_version": "1.0.0",
    "version": "1.0.0",
    "name": "operational.service123",
    "metadata": {
        "policy-id": "operational.service123"
    },
    "properties": {
        "controllerName": "frankfurt",
        "id": "ControlLoop-Service123-cbed919f-2212-4ef7-8051-fe6308da1bda",
        "timeout": 60,
        "abatement": true,
        "trigger": "unique-policy-id-1-restart",
        "operations": [
            {
                "id": "unique-policy-id-1-restart",
                "description": "Restart the VM",
                "operation": {
                    "actor": "APPC",
                    "operation": "Restart",
                    "target": {
                        "targetType": "VM"
                    }
                },
                "timeout": 20,
                "retries": 3,
                "success": "final_success",
                "failure": "unique-policy-id-2-rebuild",
                "failure_timeout": "unique-policy-id-2-rebuild",
                "failure_retries": "unique-policy-id-2-rebuild",
                "failure_guard": "unique-policy-id-2-rebuild",
                "failure_exception": "final_failure_exception"
            },
            {
                "id": "unique-policy-id-2-rebuild",
                "name": "Rebuild Policy",
                "operation": {
                    "actor": "APPC",
                    "operation": "Rebuild",
                    "target": {
                        "targetType": "VM"
                    }
                },
                "timeout": 10,
                "retries": 0,
                "success": "final_success",
                "failure": "unique-policy-id-3-migrate",
                "failure_timeout": "unique-policy-id-3-migrate",
                "failure_retries": "unique-policy-id-3-migrate",
                "failure_guard": "unique-policy-id-3-migrate",
                "failure_exception": "final_failure_exception"
            },
            {
                "id": "unique-policy-id-3-migrate",
                "name": "Migrate Policy",
                "operation": {
                    "actor": "APPC",
                    "operation": "Migrate",
                    "target": {
                        "targetType": "VM"
                    }
                },
                "timeout": 30,
                "retries": 0,
                "success": "final_success",
                "failure": "final_failure",
                "failure_timeout": "final_failure_timeout",
                "failure_retries": "final_failure_retries",
                "failure_guard": "final_failure_guard",
                "failure_exception": "final_failure_exception"
            }
        ]
    }
}
