{
    "type": "onap.policies.controlloop.operational.common.Drools",
    "type_version": "1.0.0",
    "name": "operational.modifyconfig",
    "version": "1.0.0",
    "metadata": {
        "policy-id": "operational.pcihandler"
    },
    "properties": {
        "controllerName": "usecases",
        "id": "ControlLoop-vPCI-fb41f388-a5f2-11e8-98d0-529269fb1459",
        "timeout": 1200,
        "abatement": false,
        "trigger": "unique-policy-id-123-modifyconfig",
        "operations": [
            {
                "id": "unique-policy-id-123-modifyconfig",
                "description": "Modify the packet generator",
                "operation": {
                    "actor": "SDNR",
                    "operation": "ModifyConfig",
                    "target": {
                        "targetType": "VNF"
                    }
                },
                "timeout": 7,
                "retries": 0,
                "success": "final_success",
                "failure": "final_failure",
                "failure_timeout": "final_failure_timeout",
                "failure_retries": "final_failure_retries",
                "failure_exception": "final_failure_exception",
                "failure_guard": "final_failure_guard"
            }
        ]
    }
}
